{
  "$schema": "../schema/state-machine-integrity.schema.json",
  "$comment": "GENERATED - DO NOT EDIT MANUALLY. Source: packages/foundation/src/workflow/state-machine/definitions/**/*.json",
  "version": "v0.0.1:registry:state-machine-integrity-1",
  "generatedAt": "1970-01-01T00:00:00.000Z",
  "definitionRoot": "packages/foundation/src/workflow/state-machine/definitions",
  "definitionCount": 25,
  "hashAlgorithm": "canonical-json-sha256",
  "machines": [
    {
      "machineId": "acceptance.approval-governance",
      "entityType": "capability_acceptance",
      "version": "v0.0.1:state-machine:capability-acceptance-approval-governance-3",
      "path": "packages/foundation/src/workflow/state-machine/definitions/acceptance/approval-governance.json",
      "canonicalSha256": "sha256:b5a918a7c0c491216ab29b3696a80bd3428653a140f162026dd82ee4ade9f8cb",
      "stateCount": 5,
      "eventCount": 8,
      "matrixCellCount": 40,
      "initialState": "planned",
      "terminalStateIds": [
        "verified"
      ]
    },
    {
      "machineId": "acceptance.console-administration",
      "entityType": "capability_acceptance",
      "version": "v0.0.1:state-machine:capability-acceptance-console-administration-3",
      "path": "packages/foundation/src/workflow/state-machine/definitions/acceptance/console-administration.json",
      "canonicalSha256": "sha256:244383535c9ede809b9a143882f402d81fdfc68466e79bc7009fc608a79e8566",
      "stateCount": 5,
      "eventCount": 8,
      "matrixCellCount": 40,
      "initialState": "planned",
      "terminalStateIds": [
        "verified"
      ]
    },
    {
      "machineId": "acceptance.container-deployment-resumability",
      "entityType": "capability_acceptance",
      "version": "v0.0.1:state-machine:capability-acceptance-container-deployment-resumability-3",
      "path": "packages/foundation/src/workflow/state-machine/definitions/acceptance/container-deployment-resumability.json",
      "canonicalSha256": "sha256:732701212974d4847c559e633b1f6a5b2253a42fff1cb0de8e44ec74e5e7ab8d",
      "stateCount": 5,
      "eventCount": 8,
      "matrixCellCount": 40,
      "initialState": "planned",
      "terminalStateIds": [
        "verified"
      ]
    },
    {
      "machineId": "acceptance.core-workspace-assets-governance",
      "entityType": "capability_acceptance",
      "version": "v0.0.1:state-machine:capability-acceptance-core-workspace-assets-governance-3",
      "path": "packages/foundation/src/workflow/state-machine/definitions/acceptance/core-workspace-assets-governance.json",
      "canonicalSha256": "sha256:8cefb9e24e65549f24b3e2bf16ae22991353f81ceab640e2afb4bfb6bfdff383",
      "stateCount": 5,
      "eventCount": 8,
      "matrixCellCount": 40,
      "initialState": "planned",
      "terminalStateIds": [
        "verified"
      ]
    },
    {
      "machineId": "acceptance.downstream-mcp-gateway",
      "entityType": "capability_acceptance",
      "version": "v0.0.1:state-machine:capability-acceptance-downstream-mcp-gateway-3",
      "path": "packages/foundation/src/workflow/state-machine/definitions/acceptance/downstream-mcp-gateway.json",
      "canonicalSha256": "sha256:ac253218ad590e04efa9e12ce6ec546c00b91782c7b52d7c7b9dfabdfea64371",
      "stateCount": 5,
      "eventCount": 8,
      "matrixCellCount": 40,
      "initialState": "planned",
      "terminalStateIds": [
        "verified"
      ]
    },
    {
      "machineId": "acceptance.execution-sandbox",
      "entityType": "capability_acceptance",
      "version": "v0.0.1:state-machine:capability-acceptance-execution-sandbox-3",
      "path": "packages/foundation/src/workflow/state-machine/definitions/acceptance/execution-sandbox.json",
      "canonicalSha256": "sha256:21c20d4007aaf9fa4fedce563b9f510cedb66936be572fe31acde66dba5b1c77",
      "stateCount": 5,
      "eventCount": 8,
      "matrixCellCount": 40,
      "initialState": "planned",
      "terminalStateIds": [
        "verified"
      ]
    },
    {
      "machineId": "acceptance.jobs-work-queue-runtime",
      "entityType": "capability_acceptance",
      "version": "v0.0.1:state-machine:capability-acceptance-jobs-work-queue-runtime-3",
      "path": "packages/foundation/src/workflow/state-machine/definitions/acceptance/jobs-work-queue-runtime.json",
      "canonicalSha256": "sha256:e70166f348820344aa2cbb33530b26a70772019995ca1983dde5b221c329df96",
      "stateCount": 5,
      "eventCount": 8,
      "matrixCellCount": 40,
      "initialState": "planned",
      "terminalStateIds": [
        "verified"
      ]
    },
    {
      "machineId": "acceptance.mcp-native-installer-process-identity",
      "entityType": "capability_acceptance",
      "version": "v0.0.1:state-machine:capability-acceptance-mcp-native-installer-process-identity-3",
      "path": "packages/foundation/src/workflow/state-machine/definitions/acceptance/mcp-native-installer-process-identity.json",
      "canonicalSha256": "sha256:ce3225eee3c0643cb8506b69b1ad76e1e2b33af66bf2f2bdfefbfcf349951338",
      "stateCount": 5,
      "eventCount": 8,
      "matrixCellCount": 40,
      "initialState": "planned",
      "terminalStateIds": [
        "verified"
      ]
    },
    {
      "machineId": "acceptance.model-gateway-service",
      "entityType": "capability_acceptance",
      "version": "v0.0.1:state-machine:capability-acceptance-model-gateway-service-3",
      "path": "packages/foundation/src/workflow/state-machine/definitions/acceptance/model-gateway-service.json",
      "canonicalSha256": "sha256:68071835dce68dcefdadfbd4b1bbc8fc087288cb2ae65bf55eb12b956b52aac7",
      "stateCount": 5,
      "eventCount": 8,
      "matrixCellCount": 40,
      "initialState": "planned",
      "terminalStateIds": [
        "verified"
      ]
    },
    {
      "machineId": "acceptance.observability-alerts-reporting",
      "entityType": "capability_acceptance",
      "version": "v0.0.1:state-machine:capability-acceptance-observability-alerts-reporting-3",
      "path": "packages/foundation/src/workflow/state-machine/definitions/acceptance/observability-alerts-reporting.json",
      "canonicalSha256": "sha256:7b29ace9374ad882bdd34c095283ba6e9dd998e60c44ba9b00517514848f641c",
      "stateCount": 5,
      "eventCount": 8,
      "matrixCellCount": 40,
      "initialState": "planned",
      "terminalStateIds": [
        "verified"
      ]
    },
    {
      "machineId": "acceptance.operation-permission-authorization",
      "entityType": "capability_acceptance",
      "version": "v0.0.1:state-machine:capability-acceptance-operation-permission-authorization-3",
      "path": "packages/foundation/src/workflow/state-machine/definitions/acceptance/operation-permission-authorization.json",
      "canonicalSha256": "sha256:944050d50d85081a3eb91ea49e10db2e51075a2fcdf32431547e8e6dd85bcf8f",
      "stateCount": 5,
      "eventCount": 8,
      "matrixCellCount": 40,
      "initialState": "planned",
      "terminalStateIds": [
        "verified"
      ]
    },
    {
      "machineId": "acceptance.pactium-cryptographic-foundation",
      "entityType": "capability_acceptance",
      "version": "v0.0.1:state-machine:capability-acceptance-pactium-cryptographic-foundation-3",
      "path": "packages/foundation/src/workflow/state-machine/definitions/acceptance/pactium-cryptographic-foundation.json",
      "canonicalSha256": "sha256:29971392f3a3479ed7ec5ee6f0f6dbe5d4ed4bfa9099636b579d1f3bc46b0ea9",
      "stateCount": 5,
      "eventCount": 8,
      "matrixCellCount": 40,
      "initialState": "planned",
      "terminalStateIds": [
        "verified"
      ]
    },
    {
      "machineId": "acceptance.plugin-runtime-and-module-system",
      "entityType": "capability_acceptance",
      "version": "v0.0.1:state-machine:capability-acceptance-plugin-runtime-and-module-system-3",
      "path": "packages/foundation/src/workflow/state-machine/definitions/acceptance/plugin-runtime-and-module-system.json",
      "canonicalSha256": "sha256:d70ada51e1653e1ce168749d73eacb0dc251756e2dbcf061ebb02d7e4febb68a",
      "stateCount": 5,
      "eventCount": 8,
      "matrixCellCount": 40,
      "initialState": "planned",
      "terminalStateIds": [
        "verified"
      ]
    },
    {
      "machineId": "acceptance.state-machine-governance",
      "entityType": "capability_acceptance",
      "version": "v0.0.1:state-machine:capability-acceptance-state-machine-governance-3",
      "path": "packages/foundation/src/workflow/state-machine/definitions/acceptance/state-machine-governance.json",
      "canonicalSha256": "sha256:1b89f6d34bec725d866000137fe14acfa3a01f9c02563e7d3f32aee50b568c72",
      "stateCount": 5,
      "eventCount": 8,
      "matrixCellCount": 40,
      "initialState": "planned",
      "terminalStateIds": [
        "verified"
      ]
    },
    {
      "machineId": "acceptance.storage-backup-runtime",
      "entityType": "capability_acceptance",
      "version": "v0.0.1:state-machine:capability-acceptance-storage-backup-runtime-3",
      "path": "packages/foundation/src/workflow/state-machine/definitions/acceptance/storage-backup-runtime.json",
      "canonicalSha256": "sha256:7bce6ab6881eb65f9fe0528334cffc9c9a35ef1fe6ad366f97cefd0ba514ac73",
      "stateCount": 5,
      "eventCount": 8,
      "matrixCellCount": 40,
      "initialState": "planned",
      "terminalStateIds": [
        "verified"
      ]
    },
    {
      "machineId": "acceptance.strategy-management",
      "entityType": "capability_acceptance",
      "version": "v0.0.1:state-machine:capability-acceptance-strategy-management-3",
      "path": "packages/foundation/src/workflow/state-machine/definitions/acceptance/strategy-management.json",
      "canonicalSha256": "sha256:687b915fbfc4069d55b25ccd6d74daf8698cef67bc4f53aaa54d55c4c37afea6",
      "stateCount": 5,
      "eventCount": 8,
      "matrixCellCount": 40,
      "initialState": "planned",
      "terminalStateIds": [
        "verified"
      ]
    },
    {